title,start_date,votes,replies,url
How to open a windows file open or save dialog without crashing Unity?,"Jul 28, 2015 5:04:42 AM",7,3,https://answers.unity3d.com/questions/14869/how-to-open-a-windows-file-open-or-save-dialog-wit.html
Dual monitor support?,"Jan 4, 2016 8:16:21 AM",7,6,https://answers.unity3d.com/questions/14720/dual-monitor-support.html
I want to make a train go round a track using physics?,"Mar 17, 2015 7:32:26 AM",7,7,https://answers.unity3d.com/questions/14580/i-want-to-make-a-train-go-round-a-track-using-phys.html
How can forum users be encouraged to become active at UnityAnswers?,"Mar 29, 2010 2:22:05 PM",7,6,https://answers.unity3d.com/questions/14024/how-can-forum-users-be-encouraged-to-become-active.html
Using RayCast to Get Mouse Input,"Feb 14, 2013 3:05:44 PM",7,1,https://answers.unity3d.com/questions/13577/using-raycast-to-get-mouse-input.html
Performance Differences in Standalone player versus Web Browser?,"Mar 17, 2010 1:19:07 AM",7,2,https://answers.unity3d.com/questions/12765/performance-differences-in-standalone-player-versu.html
Should i be able to add gameobjects as children to a parent with a rigidbody?,"Feb 26, 2010 12:47:42 AM",7,1,https://answers.unity3d.com/questions/12164/should-i-be-able-to-add-gameobjects-as-children-to.html
Something like GUI.Table or a Grid?,"Feb 22, 2016 12:43:06 AM",7,5,https://answers.unity3d.com/questions/12108/something-like-guitable-or-a-grid.html
Is it possible to broadcast to all objects in scene?,"Oct 2, 2017 9:56:22 PM",7,7,https://answers.unity3d.com/questions/12103/is-it-possible-to-broadcast-to-all-objects-in-scen.html
Convert String to Float,"Jun 9, 2014 2:28:13 PM",7,6,https://answers.unity3d.com/questions/11581/convert-string-to-float.html
How do I make a 2d game in Unity3d?,"Dec 21, 2012 12:19:39 AM",7,6,https://answers.unity3d.com/questions/11440/how-do-i-make-a-2d-game-in-unity3d.html
How does one inspect static vars?,"May 19, 2016 9:03:34 AM",7,3,https://answers.unity3d.com/questions/11098/how-does-one-inspect-static-vars.html
XmlException: Text node canot appear in this state,"Apr 2, 2017 10:04:48 AM",7,5,https://answers.unity3d.com/questions/10904/xmlexception-text-node-canot-appear-in-this-state.html
"""Can't find namespace"" - accessing Javascript from C# (or C# from Javascript)","May 22, 2017 2:36:52 PM",7,4,https://answers.unity3d.com/questions/10856/cant-find-namespace-accessing-javascript-from-c-or.html
"What is the maximum byte length of Application.ExternalCall? (and oh yea, it doesn't escape strings correctly)","Jun 29, 2016 10:25:46 AM",7,3,https://answers.unity3d.com/questions/10842/what-is-the-maximum-byte-length-of-applicationexte.html
How can Script Tell if it's in Web Player vs. Standalone?,"Feb 18, 2015 4:24:06 AM",7,3,https://answers.unity3d.com/questions/10364/how-can-script-tell-if-its-in-web-player-vs-standa.html
Unload a plugin,"Sep 3, 2012 9:10:46 PM",7,4,https://answers.unity3d.com/questions/10216/unload-a-plugin.html
Unity Crashes on startup,"Apr 28, 2017 5:47:47 AM",7,19,https://answers.unity3d.com/questions/10086/unity-crashes-on-startup.html
How do I count or get references to all gameobjects that are tagged with a particular tag?,"Jan 19, 2017 4:30:13 PM",7,2,https://answers.unity3d.com/questions/9821/how-do-i-count-or-get-references-to-all-gameobject.html
Time.time explanation.,"Mar 6, 2015 10:37:39 PM",7,1,https://answers.unity3d.com/questions/9757/timetime-explanation.html
Terrain scaling,"Jul 18, 2012 6:32:53 PM",7,2,https://answers.unity3d.com/questions/9581/terrain-scaling.html
Texture Size Guidelines for iPhone,"Dec 25, 2009 3:36:41 PM",7,3,https://answers.unity3d.com/questions/9445/texture-size-guidelines-for-iphone.html
Is there a way to have debug code compiled out for a final build?,"Jul 22, 2015 3:28:59 PM",7,5,https://answers.unity3d.com/questions/9316/is-there-a-way-to-have-debug-code-compiled-out-for.html
How could I implement cheat codes in my game?,"Aug 30, 2015 5:26:10 PM",7,2,https://answers.unity3d.com/questions/9299/how-could-i-implement-cheat-codes-in-my-game.html
How to use XML Serialization to load custom asset types,"Aug 22, 2010 7:02:17 PM",7,3,https://answers.unity3d.com/questions/9229/how-to-use-xml-serialization-to-load-custom-asset.html
What is the difference between BroadcastMessage() and SendMessage()?,"Dec 13, 2009 5:18:40 PM",7,1,https://answers.unity3d.com/questions/9005/what-is-the-difference-between-broadcastmessage-an.html
How do I make my webplayer fill the entire browser window?,"Jul 25, 2016 11:49:49 PM",7,8,https://answers.unity3d.com/questions/8819/how-do-i-make-my-webplayer-fill-the-entire-browser.html
How many players does Unity's built-in networking support?,"Dec 3, 2009 12:16:33 PM",7,1,https://answers.unity3d.com/questions/8597/how-many-players-does-unitys-built-in-networking-s.html
How to get started learning JavaScript or UnityScript?,"May 18, 2012 10:13:55 PM",7,6,https://answers.unity3d.com/questions/8329/how-to-get-started-learning-javascript-or-unityscr.html
The type or namespace 'var' could not be found (in C#),"Mar 10, 2010 6:50:29 PM",7,7,https://answers.unity3d.com/questions/8259/the-type-or-namespace-var-could-not-be-found-in-c.html
How do I use an XBOX 360 controller in Unity?,"Jun 13, 2017 4:07:54 PM",7,6,https://answers.unity3d.com/questions/8019/how-do-i-use-an-xbox-360-controller-in-unity.html
Better shader effects on terrain - Bumpmapping or Specular?,"Jun 11, 2015 9:05:49 AM",7,2,https://answers.unity3d.com/questions/7926/better-shader-effects-on-terrain-bumpmapping-or-sp.html
Preloading / Caching Prefabs [Unity iPhone],"Nov 20, 2009 12:59:48 PM",7,4,https://answers.unity3d.com/questions/7836/preloading-caching-prefabs-unity-iphone.html
"If I have a button over my 3d world, how can I detect if a mouseClick was in the world or not?","Jan 26, 2015 4:46:28 AM",7,5,https://answers.unity3d.com/questions/7531/if-i-have-a-button-over-my-3d-world-how-can-i-dete.html
"Help!Crash! FatalError""Callback registration failed kMaxCallback""","Sep 29, 2017 6:32:25 PM",6,1,https://answers.unity3d.com/questions/1390740/callback-registration-failed-kmaxcallback.html
How do you set the vertex compression and mesh optimization player settings programmatically,"Jun 28, 2017 5:24:33 PM",6,0,https://answers.unity3d.com/questions/1371281/how-do-you-set-the-vertex-compression-and-mesh-opt.html
Problem with changing Unity 2017 to .Net 4.6,"Aug 19, 2017 10:02:02 PM",6,2,https://answers.unity3d.com/questions/1364065/problem-with-changing-unity-2017-to-net-46.html
How to avoid the white screen before Splashscreen on android mobile.,"Jul 18, 2017 8:54:13 PM",6,2,https://answers.unity3d.com/questions/1358574/how-to-avoid-the-white-screen-before-splashscreen.html
Vive controllers not tracking in Unity 5.6.0b3,"Oct 6, 2017 1:23:33 AM",6,15,https://answers.unity3d.com/questions/1299567/vive-controllers-not-tracking-in-unity-560b3.html
"Why are m_SizeDelta and m_AnchoredPosition values changing in scene file for no reason, complicating merge?","Jun 9, 2017 5:17:22 PM",6,3,https://answers.unity3d.com/questions/1265585/why-are-m-sizedelta-and-m-anchoredposition-values.html
Screen.orientation on  ios10 for Unity 5.4.3,"Dec 6, 2016 3:52:38 PM",6,3,https://answers.unity3d.com/questions/1245701/screenorientation-on-ios10-for-unity-543.html
[SOLUTION] set UI RectTransform Anchor Presets from code c#,"Jul 8, 2017 7:44:47 PM",6,0,https://answers.unity3d.com/questions/1225118/solution-set-ui-recttransform-anchor-presets-from.html
[Android - Data save issues] Does the 'install location' determine the location of persistentDataPath?,"Sep 24, 2017 7:21:26 PM",6,1,https://answers.unity3d.com/questions/1223929/android-data-save-issues-does-the-install-location.html
When will draw mode be available in 2d sprite renderer,"Jul 22, 2016 3:41:24 PM",6,0,https://answers.unity3d.com/questions/1219465/when-will-draw-mode-be-available-in-2d-sprite-rend.html
Peer-to-Peer vs Client-Server vs Dedicated Server Networking,"Dec 1, 2016 4:56:16 AM",6,1,https://answers.unity3d.com/questions/1205503/dedicated-server-vs-peer-to-peer-networking.html
prevent UnityWebRequest.Post() from Url-Encoding the data ?,"Oct 11, 2017 7:03:05 PM",6,1,https://answers.unity3d.com/questions/1163204/prevent-unitywebrequestpost-from-url-encoding-the.html
"How to.. ""Add a delegate to this to get notifications""..","Jan 3, 2017 6:12:56 PM",6,3,https://answers.unity3d.com/questions/1160006/how-to-add-a-delegate-to-this-to-get-notifications.html
What happened to conveniently replacing component scripts in the inspector?,"Aug 8, 2017 5:54:10 AM",6,1,https://answers.unity3d.com/questions/1125244/what-happened-to-conveniently-replacing-component.html
5.3 Multiple Display Canvases,"Oct 11, 2016 9:39:35 AM",6,1,https://answers.unity3d.com/questions/1111243/53-multiple-display-canvases.html
Enabling occlusion culling stops point lights (which cast shadows) from rendering in Unity 5.2p3,"Nov 9, 2015 10:54:09 AM",6,1,https://answers.unity3d.com/questions/1079942/enabling-occlusion-culling-stops-point-lights-whic.html
VSync won't disable,"Mar 20, 2016 4:31:05 PM",6,2,https://answers.unity3d.com/questions/1079804/vsync-wont-disable.html
Error while installing VSTU (error cod 1603),"Jan 28, 2016 1:58:06 AM",6,1,https://answers.unity3d.com/questions/1078345/error-while-installing-vstu-error-cod-1603.html
Application.isLoadingLevel Deprecation,"Jun 4, 2017 8:47:40 PM",6,7,https://answers.unity3d.com/questions/1068801/applicationisloadinglevel-deprecation.html
Unity 5.2 InputField missing caret,"Oct 26, 2015 9:06:34 PM",6,1,https://answers.unity3d.com/questions/1063644/unity-52-inputfield-missing-caret.html
FrameRate droped after Unity 5.2,"Dec 9, 2015 6:36:52 PM",6,3,https://answers.unity3d.com/questions/1063557/framerate-droped-after-unity-52.html
How is asset bundle crc and hash created?,"Jun 29, 2016 8:40:50 AM",6,0,https://answers.unity3d.com/questions/1041405/how-is-asset-bundle-crc-and-hash-created.html
How to fix: Broken YAML file. Local file identifier doesn't exist,"Aug 7, 2015 11:24:33 AM",6,1,https://answers.unity3d.com/questions/1015524/how-to-fix-broken-yaml-file-local-file-identifier.html
only pot textures can be compressed if mipmaps are enabled,"Apr 14, 2016 8:52:16 PM",6,1,https://answers.unity3d.com/questions/1010066/only-pot-textures-can-be-compressed-if-mipmaps-are.html
"Error: Service not available, please try again later.","May 8, 2017 8:29:32 PM",6,8,https://answers.unity3d.com/questions/1003966/error-service-not-available-please-try-again-later.html
Unity - Stuck in Build 7/11 Light Transport - 1 Job,"Oct 30, 2017 5:11:03 PM",6,10,https://answers.unity3d.com/questions/984698/unity-stuck-in-build-711-light-transport-1-job.html
Saving your scene and location in game?,"May 13, 2016 5:55:19 AM",6,1,https://answers.unity3d.com/questions/967840/saving-your-scene-and-location-in-game.html
How to mark AssetBundle label from script in Unity5?,"Nov 30, 2016 6:42:38 PM",6,1,https://answers.unity3d.com/questions/965809/how-to-mark-assetbundle-label-from-script-in-unity.html
Billboard Renderer,"Dec 31, 2015 11:31:09 AM",6,1,https://answers.unity3d.com/questions/954871/billboard-renderer-1.html
Unity Web Player Plugin is completely broken in latest version of Chrome for Windows - version 42.0.2311.90,"Jan 15, 2016 3:54:24 AM",6,3,https://answers.unity3d.com/questions/947831/unity-web-player-plugin-is-completely-broken-in-la.html
White textures when objects are really far away on android?,"Jan 12, 2017 6:10:58 PM",6,1,https://answers.unity3d.com/questions/935939/white-textures-when-objects-are-really-far-away-on.html
Time.frameCount vs. Time.renderedFrameCount,"Feb 23, 2017 9:59:03 PM",6,3,https://answers.unity3d.com/questions/933751/timeframecount-vs-timerenderedframecount.html
Animate Image UI with Sprite Sheet,"Nov 11, 2015 12:59:57 AM",6,2,https://answers.unity3d.com/questions/931917/animate-image-ui-with-sprite-sheet.html
Standalone Mac Build Crashes on OSX 10.10,"Apr 16, 2016 1:35:33 PM",6,2,https://answers.unity3d.com/questions/928486/standalone-mac-build-crashes-on-osx-1010.html
"In Unity 5, how do I replace files instead of appending ""1"" and duplicating?","Aug 29, 2015 12:08:41 AM",6,4,https://answers.unity3d.com/questions/926826/in-unity-5-how-do-i-replace-files-instead-of-appen.html
Survival Shooter Tutorial fix for Unity 5,"Feb 18, 2017 1:20:01 PM",6,3,https://answers.unity3d.com/questions/920178/survival-shooter-tutorial-fix-for-unity-5.html
Unity 5 Personal iOS Splash Screen Problem?,"Nov 21, 2016 3:45:16 PM",6,-1,https://answers.unity3d.com/questions/919069/unity-5-personal-ios-splash-screen-problem.html
How to fire UnityEvent with parameters passed programmatically,"Jun 9, 2016 12:04:04 PM",6,2,https://answers.unity3d.com/questions/917623/how-to-fire-unityevent-with-parameters-passed-prog.html
Unity 5 iPhone Builds. Bad Access,"Jun 11, 2017 1:52:00 AM",6,4,https://answers.unity3d.com/questions/917164/unity-5-iphone-builds-bad-access.html
"how to remove ""development build"" stamp.","Nov 3, 2015 1:27:59 AM",6,5,https://answers.unity3d.com/questions/916352/how-to-remove-development-build-stamp.html
"I can't find "" skyboxes "" assest ? unity 5","Mar 2, 2016 4:30:48 AM",6,5,https://answers.unity3d.com/questions/916310/i-cant-find-skyboxes-assest-unity-5.html
Standard Shader Emission control via Script,"Oct 31, 2017 3:09:27 PM",6,3,https://answers.unity3d.com/questions/914923/standard-shader-emission-control-via-script.html
Unity 5 - Multithreading?,"Aug 19, 2016 5:29:35 PM",6,4,https://answers.unity3d.com/questions/908054/unity-5-multithreading.html
Workaround for using invoke for methods with parameters,"Jul 8, 2017 4:45:03 PM",6,5,https://answers.unity3d.com/questions/897095/workaround-for-using-invoke-for-methods-with-param.html
UI Text Small on screen device.,"Apr 24, 2017 1:37:46 AM",6,1,https://answers.unity3d.com/questions/891881/ui-text-small-on-screen-device.html
"World Space canvas on top of ""everything"" ?","Oct 30, 2017 10:29:52 PM",6,6,https://answers.unity3d.com/questions/878667/world-space-canvas-on-top-of-everything.html
Button is being triggered by spacebar after clicked once,"May 16, 2017 3:57:58 PM",6,1,https://answers.unity3d.com/questions/859460/button-is-being-triggered-by-spacebar-after-clicke.html
4.6 UI Image follow mouse position?,"Oct 20, 2017 10:18:10 AM",6,4,https://answers.unity3d.com/questions/849117/46-ui-image-follow-mouse-position.html
Can I configure a Rect Transform to preserve its aspect ratio while stretching?,"Nov 14, 2014 9:03:29 AM",6,1,https://answers.unity3d.com/questions/831047/can-i-configure-a-rect-transform-to-preserve-its-a.html
Animation layers with Unity 2D mecanim,"Jan 7, 2015 12:35:58 AM",6,0,https://answers.unity3d.com/questions/830683/animation-layers-with-unity-2d-mecanim.html
Why aren't public variables shown in the Inspector when inheriting from Unity 4.6 UI's Button?,"Sep 17, 2016 2:45:57 AM",6,4,https://answers.unity3d.com/questions/814870/why-arent-public-variables-shown-in-the-inspector.html
How to Reduce draw calls in unity3d,"Nov 24, 2014 11:35:39 AM",6,2,https://answers.unity3d.com/questions/811190/how-to-reduce-draw-calls-in-unity3d.html
"How to get width of RectTransform? (in screen coordinates, for position relative to, say, mouse input)","Dec 27, 2016 11:54:38 AM",6,2,https://answers.unity3d.com/questions/806948/how-to-get-width-of-recttransform-in-screen-coordi.html
New UI: How to change depth/order from script?,"Jun 15, 2017 8:10:01 AM",6,3,https://answers.unity3d.com/questions/806928/new-ui-how-to-change-depthorder-from-script.html
Hide UnityEngine.Debug.Log(Object) in Console,"Mar 14, 2017 6:24:20 AM",6,3,https://answers.unity3d.com/questions/804262/hide-unityenginedebuglogobject-in-console.html
What class is a Panel?,"Feb 19, 2015 4:12:53 PM",6,2,https://answers.unity3d.com/questions/800208/what-class-is-a-panel.html
"Single [SerializeField], multiple fields","Jun 3, 2017 11:33:34 AM",6,2,https://answers.unity3d.com/questions/785232/single-serializefield-multiple-fields.html
Change the color of the Unity 4.6 buttons in code,"Oct 28, 2016 8:06:53 PM",6,2,https://answers.unity3d.com/questions/785163/change-the-color-of-the-unity-46-buttons-in-code.html
New UI buttons doesn't work,"Aug 8, 2016 3:48:12 PM",6,4,https://answers.unity3d.com/questions/780043/new-ui-buttons-doesnt-work.html
[META] basic problem: general programming v. Unity questions,"Dec 2, 2014 1:14:17 PM",6,1,https://answers.unity3d.com/questions/771329/meta-basic-problem-general-programming-v-unity-que.html
Mecanim - Trigger event at end of animation state,"Nov 29, 2016 4:47:49 AM",6,4,https://answers.unity3d.com/questions/750785/mecanim-trigger-event-at-end-of-animation-state.html
What is good practice to set Pixels to Units to and how does it actually work ?,"Dec 16, 2015 5:34:10 PM",6,1,https://answers.unity3d.com/questions/736142/what-is-good-practice-to-set-pixels-to-units-to-an.html
What are the Javascript compiler errors?,"Aug 11, 2015 1:45:16 PM",6,0,https://answers.unity3d.com/questions/723812/what-are-the-javascript-compiler-errors.html
[meta] Is Answers doomed?,"May 28, 2014 6:30:40 PM",6,9,https://answers.unity3d.com/questions/708982/meta-is-answers-doomed.html
Cannot enabled / disable a script component?,"Jun 19, 2017 6:16:39 AM",6,1,https://answers.unity3d.com/questions/694778/cant-uncrosscross-a-script-component.html
"Android App Restarts when ""Launched""","Dec 22, 2015 9:00:06 AM",6,2,https://answers.unity3d.com/questions/690512/android-app-restarts-when-launched.html
Google Play Games plugin for Unity Not Authenticating,"Jan 10, 2017 2:32:46 PM",6,9,https://answers.unity3d.com/questions/679424/google-play-games-plugin-for-unity-not-authenticat.html
Cogwheel icon in inspector,"Jan 9, 2017 11:16:14 AM",6,1,https://answers.unity3d.com/questions/678637/cogwheel-icon-in-inspector.html
Does Unity call Destroy on a ScriptableObject that nobody's referencing? or do I have to manually Destroy it?,"Mar 12, 2017 12:14:54 AM",6,2,https://answers.unity3d.com/questions/639852/does-unity-call-destroy-on-a-scriptableobject-that.html
MecAnim Root Motion - How To Prevent It,"Sep 15, 2017 8:05:36 AM",6,2,https://answers.unity3d.com/questions/615687/mecanim-root-motion-how-to-prevent-it.html
Game Object On Touch Event on Android-iPhone 2D,"May 6, 2016 12:45:20 AM",6,4,https://answers.unity3d.com/questions/610440/on-touch-event-on-game-object-on-android-2d.html
Sprites Become Invisible (SOLVED),"Sep 26, 2017 5:08:13 PM",6,2,https://answers.unity3d.com/questions/610165/sprites-become-invisible.html
Trail Renderer and Sorting Layer problem,"May 12, 2017 5:28:05 PM",6,2,https://answers.unity3d.com/questions/608095/trail-renderer-and-sorting-layer-problem.html
#if UNITY_EDITOR stuff getting called at runtime as well?,"Sep 24, 2015 8:28:01 PM",6,2,https://answers.unity3d.com/questions/604503/if-unity-editor-stuff-getting-called-at-runtime-as.html
Generating a good random seed,"Aug 23, 2016 5:28:29 AM",6,2,https://answers.unity3d.com/questions/603000/generating-a-good-random-seed.html
why isn't my OnTriggerEnter2D() function working?,"Sep 3, 2017 7:23:23 AM",6,6,https://answers.unity3d.com/questions/592567/why-isnt-my-ontriggerenter2d-function-working.html
Can I access the color preset by code?,"Jan 2, 2015 3:51:56 AM",6,1,https://answers.unity3d.com/questions/590562/can-i-access-the-color-preset-by-code.html
Implement voice recognition in Unity?,"Jun 18, 2017 10:47:43 PM",6,5,https://answers.unity3d.com/questions/587899/implement-voice-recognition-in-unity.html
Unity 4.3 crashes on Mac when debugging on Monodevelop 4.0.1,"Feb 16, 2015 12:31:45 AM",6,3,https://answers.unity3d.com/questions/580310/unity-43-crashes-on-mac-when-debugging-on-monodeve.html
One way platform using 2D Colliders?,"May 8, 2016 8:33:32 PM",6,11,https://answers.unity3d.com/questions/576044/one-way-platform-using-2d-colliders.html
Switch platform is extremely slow,"Oct 15, 2013 8:29:26 PM",6,2,https://answers.unity3d.com/questions/556484/switch-platform-is-extremely-slow.html
Ignoring folder meta files on version control,"Oct 29, 2013 7:19:38 AM",6,1,https://answers.unity3d.com/questions/547795/ignoring-folder-meta-files-on-version-control.html
EditorGUILayout split view (resizable scroll view),"Aug 30, 2017 3:36:02 PM",6,1,https://answers.unity3d.com/questions/546686/editorguilayout-split-view-resizable-scroll-view.html
How to add Billing permission to .apk file?,"Apr 1, 2015 10:54:15 AM",6,1,https://answers.unity3d.com/questions/545779/how-to-add-billing-permission-to-apk-file.html
What is the best way to pass data between scenes?,"Jun 9, 2015 12:06:48 AM",6,2,https://answers.unity3d.com/questions/532656/what-is-the-best-way-to-pass-data-between-scenes.html
How can I convert a Quaternion to a direction vector?,"Jan 25, 2016 7:51:54 AM",6,2,https://answers.unity3d.com/questions/525952/how-i-can-converting-a-quaternion-to-a-direction-v.html
Is Using Coroutines Actually Faster Than Update?,"Aug 29, 2013 4:29:19 PM",6,1,https://answers.unity3d.com/questions/525854/is-using-coroutines-actually-faster-than-update.html
Creating 3d planets with terrain and atmosphere,"Jan 14, 2016 6:39:30 PM",6,3,https://answers.unity3d.com/questions/506183/creating-3d-planets-with-terrain-and-atmosphere.html
NavMesh Agent Obstacle Avoidance Ignore,"Mar 5, 2017 10:00:58 AM",6,1,https://answers.unity3d.com/questions/496659/navmesh-agent-obstacle-avoidance-ignore.html
How can i shuffle  a list,"Jul 25, 2017 3:54:28 PM",6,4,https://answers.unity3d.com/questions/486626/how-can-i-shuffle-alist.html
DropDownList with string array in Editor Inspector,"Jul 21, 2017 9:07:09 AM",6,4,https://answers.unity3d.com/questions/458987/dropdownlist-with-string-array-in-editor-inspector.html
Copy a component at runtime,"Apr 18, 2017 9:15:50 AM",6,8,https://answers.unity3d.com/questions/458207/copy-a-component-at-runtime.html
C# - Simple Voronoi/Delaunay Diagrams For Starters,"Aug 7, 2017 10:29:38 PM",6,2,https://answers.unity3d.com/questions/448156/c-simple-voronoidelaunay-diagrams-for-starters.html
"Multiple cameras, depths, and image effects!","May 15, 2014 7:37:50 AM",6,2,https://answers.unity3d.com/questions/447131/multiple-cameras-depths-and-image-effects.html
"Facebook ""Like"", Prime31 (ACTUAL $400 PayPal REWARD)","Oct 26, 2015 3:54:23 PM",6,3,https://answers.unity3d.com/questions/435671/facebook-like-using-prime31-250-reward-.html
General Tips on Project tidying,"Apr 9, 2013 6:46:14 PM",6,2,https://answers.unity3d.com/questions/434673/general-tips-on-project-tidying.html
Can I download the projects in browser instead of opening the Asset Store?,"Mar 28, 2017 4:47:48 PM",6,3,https://answers.unity3d.com/questions/431190/can-i-download-the-projects-in-browser-instead-of.html
OnMouseDown not firing?,"Jan 13, 2017 9:58:59 AM",6,17,https://answers.unity3d.com/questions/425478/onmousedown-not-firing.html
Normal distribution random,"Sep 17, 2017 9:21:13 AM",6,2,https://answers.unity3d.com/questions/421968/normal-distribution-random.html
Find out if any Button on any Gamepad has been pressed and which one,"May 27, 2016 1:12:34 PM",6,5,https://answers.unity3d.com/questions/411950/find-out-if-any-button-on-any-gamepad-has-been-pre.html
ArgumentException: Getting control 0's position in a group with only 0 controls when doing Repaint Aborting - why? C#,"Mar 2, 2016 2:26:58 AM",6,3,https://answers.unity3d.com/questions/400454/argumentexception-getting-control-0s-position-in-a-1.html
Getting surface normal from collision,"Feb 18, 2013 10:24:37 PM",6,1,https://answers.unity3d.com/questions/399421/getting-surface-normal-from-collision.html
zoom out in the animator window,"Mar 29, 2017 6:30:17 PM",6,5,https://answers.unity3d.com/questions/394660/zoom-out-in-the-animator-window.html
Finding the cause for a NullReferenceException,"May 18, 2017 12:57:48 PM",6,4,https://answers.unity3d.com/questions/390277/finding-the-cause-for-a-nullreferenceexception.html
Detecting how many times a raycast collides with a single concave meshcollider,"Aug 11, 2017 6:39:17 PM",6,1,https://answers.unity3d.com/questions/386698/detecting-how-many-times-a-raycast-collides-with-a.html
How to take a photo from a webcam?,"Aug 28, 2016 3:16:22 PM",6,2,https://answers.unity3d.com/questions/384734/how-to-take-a-photo-from-a-webcam.html
Get world coordinates from mouse click,"Jul 2, 2017 9:57:57 AM",6,2,https://answers.unity3d.com/questions/376735/get-world-coordinates-from-mouse-click.html
Exactly how does friction direction 2 work?,"Dec 30, 2012 6:25:35 PM",6,1,https://answers.unity3d.com/questions/369066/exactly-how-does-friction-direction-2-work.html
AnimationClip must be marked as Legacy,"Mar 23, 2015 3:34:45 PM",6,2,https://answers.unity3d.com/questions/357851/animationclip-must-be-marked-as-legacy.html
Singleplayer PlayerPrefs hacking - Inevitable?,"Oct 10, 2017 8:06:14 PM",6,1,https://answers.unity3d.com/questions/350294/singleplayer-playerprefs-hacking-inevitable.html
EditorGUILayout.ObjectField for Array,"May 25, 2016 7:47:24 PM",6,1,https://answers.unity3d.com/questions/334348/editorguilayoutobjectfield-for-array.html
"Avoid ""Profiler is only supported in Unity Pro"" log messages in dev build?","May 19, 2015 9:22:10 PM",6,4,https://answers.unity3d.com/questions/331826/avoid-profiler-is-only-supported-in-unity-pro-log.html
ScreenToWorldPoint() not working,"Apr 18, 2017 5:15:55 AM",6,2,https://answers.unity3d.com/questions/331558/screentoworldpoint-not-working.html
How to get all GameObjects in Scene?,"Aug 2, 2017 3:09:42 PM",6,5,https://answers.unity3d.com/questions/329395/how-to-get-all-gameobjects-in-scene.html
Activating GameObject(s) is slow,"Oct 31, 2016 2:48:45 PM",6,2,https://answers.unity3d.com/questions/327541/activating-gameobjects-is-slow.html
