title,start_date,votes,replies,url
Install 2 different versions of Unity on Mac,"Feb 20, 2014 4:04:36 PM",4,3,https://answers.unity3d.com/questions/325439/install-2-different-versions-of-unity-on-mac.html
Unity4 .Active replacement,"Feb 9, 2013 8:32:08 AM",4,2,https://answers.unity3d.com/questions/324130/unity4-active-replacement.html
[SOLVED] Derive an equation from a graph?,"Nov 23, 2012 2:16:32 PM",4,1,https://answers.unity3d.com/questions/320689/derive-an-equation-from-a-graph.html
Perform event only once on keypress,"Sep 20, 2012 11:33:47 PM",4,1,https://answers.unity3d.com/questions/320469/perform-event-only-once-on-keypress.html
stitch spheriphied terrain-like (6) planes (removing gaps from edges),"Oct 30, 2013 6:45:41 PM",4,6,https://answers.unity3d.com/questions/319082/stitch-spheriphied-terrain-like-6-planes-removing.html
how to Undo DontDestroyOnLoad,"Sep 16, 2012 5:18:44 AM",4,1,https://answers.unity3d.com/questions/317935/how-to-undo-dontdestroyonload.html
Local 'forward',"Mar 19, 2017 11:13:57 PM",4,2,https://answers.unity3d.com/questions/316918/local-forward.html
OnTriggerEnter without RigidBody,"Sep 12, 2012 3:55:42 PM",4,2,https://answers.unity3d.com/questions/316639/ontriggerenter-without-rigidbody.html
Can I obscure an object using an invisible object?,"Jul 11, 2017 5:38:14 PM",4,1,https://answers.unity3d.com/questions/316064/can-i-obscure-an-object-using-an-invisible-object.html
How to make a plane fill the field of view?,"Oct 27, 2017 1:14:12 PM",4,3,https://answers.unity3d.com/questions/314049/how-to-make-a-plane-fill-the-field-of-view.html
"Server backend for cross platform, mobile freemium game with social aspects?","Dec 4, 2016 8:31:02 AM",4,6,https://answers.unity3d.com/questions/312903/server-backend-for-cross-platform-mobile-freemium.html
External Libraries in C# scripts,"Mar 21, 2013 11:33:35 PM",4,1,https://answers.unity3d.com/questions/312700/external-libraries-in-c-scripts.html
Do screen.width and screen.height get updated depending on screen orientation on Android?,"Jun 25, 2013 10:50:59 PM",4,1,https://answers.unity3d.com/questions/310723/do-screenwidth-and-screenheight-get-updated-depend.html
Texture mipmap distance,"Feb 27, 2017 2:44:59 PM",4,1,https://answers.unity3d.com/questions/310352/texture-mipmap-distance.html
"ParticleSystem, Maintaining Particle position when emitter moves.","Jul 19, 2016 6:09:57 AM",4,1,https://answers.unity3d.com/questions/309893/particlesystem-maintaining-particle-position-when.html
What will StopCoroutine exactly do?,"Aug 27, 2012 10:27:03 AM",4,2,https://answers.unity3d.com/questions/308830/what-will-stopcoroutine-exactly-do.html
How to shutdown a server,"Mar 9, 2014 10:26:26 PM",4,1,https://answers.unity3d.com/questions/305692/how-to-shutdown-a-server.html
Rotate only mesh (not whole GameObject),"Dec 14, 2013 3:32:34 PM",4,4,https://answers.unity3d.com/questions/304805/rotate-only-mesh-not-whole-gameobject.html
Anisotropic Filtering not working on Android (Samsung),"Aug 11, 2012 11:50:48 PM",4,0,https://answers.unity3d.com/questions/300182/anisotropic-filtering-not-working-on-android-samsu.html
Does Unity support CrossFire or SLI?,"Jan 4, 2015 7:02:31 AM",4,0,https://answers.unity3d.com/questions/298732/does-unity-support-crossfire-or-sli.html
Random position inside Mesh,"Dec 16, 2015 6:46:15 PM",4,3,https://answers.unity3d.com/questions/296458/random-position-inside-mesh.html
Time.deltaTime?,"Nov 23, 2016 4:28:45 PM",4,5,https://answers.unity3d.com/questions/296336/timedeltatime.html
Force inspector to use getter/setter?,"Sep 21, 2016 7:30:50 PM",4,2,https://answers.unity3d.com/questions/295093/force-inspector-to-use-gettersetter.html
How do I create / Instatiate an array of GameObjects in C#,"Jul 15, 2013 5:36:45 PM",4,2,https://answers.unity3d.com/questions/292745/how-do-i-create-instatiate-an-array-of-gameobjects.html
How to calculate swipe speed on iOS,"Apr 15, 2016 2:49:20 PM",4,2,https://answers.unity3d.com/questions/292333/how-to-calculate-swipe-speed-on-ios.html
How can I make Unity open MonoDevelop with a target framework of .NET 4.0 instead of 3.5?,"May 21, 2014 5:44:18 PM",4,2,https://answers.unity3d.com/questions/289691/how-can-i-make-unity-open-monodevelop-with-a-targe.html
"Is there a way to force new objects to always be created at (0,0,0,)?","Jul 24, 2012 7:24:03 PM",4,2,https://answers.unity3d.com/questions/289680/is-there-a-way-to-force-new-objects-to-always-be-c.html
What built-in shader properties are there?,"Jul 25, 2012 6:02:02 AM",4,0,https://answers.unity3d.com/questions/288916/what-built-in-shader-properties-are-there.html
How to make plane look curved?,"Jun 26, 2016 4:19:49 PM",4,7,https://answers.unity3d.com/questions/288835/how-to-make-plane-look-curved.html
Access SerializedProperty for Custom classes - C#,"May 28, 2013 9:01:29 PM",4,1,https://answers.unity3d.com/questions/288653/access-serializedproperty-for-custom-classes-c-1.html
Send Application to background/Paused in Android,"Jan 24, 2016 4:58:51 PM",4,0,https://answers.unity3d.com/questions/283281/send-application-to-backgroundpaused-in-android.html
The referenced script on this Behaviour is missing!,"Apr 18, 2017 5:33:10 AM",4,6,https://answers.unity3d.com/questions/282419/the-referenced-script-on-this-behaviour-is-missing-1.html
How to access an instantiated game object using c# ?,"Jul 10, 2012 6:45:15 AM",4,1,https://answers.unity3d.com/questions/281572/how-to-access-an-instantiated-game-object-using-c-.html
Instatiate on a path,"Jan 11, 2016 4:59:40 PM",4,2,https://answers.unity3d.com/questions/280596/instatiate-on-a-path.html
Loading data from a txt file - C#,"Nov 9, 2016 3:28:31 AM",4,3,https://answers.unity3d.com/questions/279750/loading-data-from-a-txt-file-c.html
ArgumentException: control 1's position in group with only 1 control,"Jan 10, 2013 9:57:27 AM",4,1,https://answers.unity3d.com/questions/279307/argumentexception-control-1s-position-in-group-wit.html
question about Coroutines and waiting for a function to finish,"Jun 28, 2012 4:21:48 PM",4,1,https://answers.unity3d.com/questions/276055/question-about-coroutines-and-waiting-for-a-functi.html
Movie Cutscene Nightmare,"Dec 26, 2013 10:28:50 PM",4,2,https://answers.unity3d.com/questions/276025/movie-cutscene-nightmare.html
[C#] Sorting a List of Gameobjects Alphabetically,"May 21, 2015 7:58:16 PM",4,2,https://answers.unity3d.com/questions/271910/c-sorting-a-list-of-gameobjects-alphabetically.html
What does mathf.repeat actually do?,"Dec 13, 2016 12:22:23 PM",4,3,https://answers.unity3d.com/questions/271545/what-does-mathfrepeat-actually-do.html
Loading Audio Files at Runtime for Playback and Processing,"Mar 2, 2014 8:59:16 PM",4,1,https://answers.unity3d.com/questions/271537/loading-audio-files-at-runtime-for-playback-and-pr.html
With a perspective camera: Distance independent size gameobject,"Aug 7, 2017 10:53:09 AM",4,5,https://answers.unity3d.com/questions/268611/with-a-perspective-camera-distance-independent-siz.html
Editor programming experts: regarding 'Layouts'...,"Jan 11, 2017 6:40:46 AM",4,1,https://answers.unity3d.com/questions/267097/editor-programming-experts-regarding-layouts.html
General programming question on Static Classes,"Jun 13, 2012 11:34:53 AM",4,1,https://answers.unity3d.com/questions/266363/general-programming-question-on-static-classes.html
"Android Deployment Hang on ""Pushing new content to device""","Jun 23, 2016 6:58:16 AM",4,4,https://answers.unity3d.com/questions/265954/android-deployment-hang-on-pushing-new-content-to.html
If you destroy a List of Class objects...,"Jun 13, 2012 2:51:35 PM",4,1,https://answers.unity3d.com/questions/265828/if-you-destroy-a-list-of-class-objects.html
Camera Icon,"Jul 9, 2014 3:45:21 PM",4,1,https://answers.unity3d.com/questions/264917/camera-icon.html
How do I create a properly lit underwater scene?,"Aug 6, 2015 6:27:48 PM",4,4,https://answers.unity3d.com/questions/263980/how-do-i-create-a-properly-lit-underwater-scene.html
"""What is loaded"" in a build","Feb 18, 2015 2:02:23 AM",4,1,https://answers.unity3d.com/questions/263393/what-is-loaded-in-a-build.html
"Your ""own"" structs ... are they indeed passed by value?","Jul 22, 2015 5:34:52 PM",4,1,https://answers.unity3d.com/questions/261419/you-own-structs-passed-by-reference.html
Performance of an empty OnGUI?,"Oct 1, 2012 6:22:51 AM",4,1,https://answers.unity3d.com/questions/259870/performance-of-an-empty-ongui-fixedupdate.html
Which GO is the new one when i Duplicate a GO,"May 30, 2012 8:50:41 PM",4,1,https://answers.unity3d.com/questions/259675/which-go-is-the-new-one-when-i-duplicate-a-go.html
Who Killed Who - Scrolling GUI Text,"Nov 9, 2015 1:00:01 PM",4,2,https://answers.unity3d.com/questions/258368/who-killed-who-scrolling-gui-text.html
"What is the use of ""out"" in variable fields? Example:","Apr 1, 2013 3:03:08 PM",4,1,https://answers.unity3d.com/questions/257054/what-is-the-use-of-out-in-variable-fields-example.html
QR-Code Decoding for iOS and Android,"May 23, 2012 8:29:04 AM",4,0,https://answers.unity3d.com/questions/255904/qr-code-decoding-for-ios-and-android.html
aabb.IsValid() error,"Jul 16, 2016 6:59:40 AM",4,2,https://answers.unity3d.com/questions/255190/aabbisvalid-error.html
SendMessage vs MethodInfo.Invoke,"May 21, 2012 2:16:39 AM",4,1,https://answers.unity3d.com/questions/254371/sendmessage-vs-methodinfoinvoke.html
Where are the default shader files located?,"Nov 18, 2015 10:34:06 AM",4,2,https://answers.unity3d.com/questions/252815/where-are-the-default-shader-files-located.html
Rotation to direction vector?,"Aug 13, 2017 4:28:33 AM",4,3,https://answers.unity3d.com/questions/251619/rotation-to-direction-vector.html
Android Remote Kindle Fire,"Aug 1, 2014 12:45:06 AM",4,1,https://answers.unity3d.com/questions/250366/android-remote-kindle-fire.html
Refresh OnDrawGizmos,"Feb 4, 2013 11:04:31 PM",4,1,https://answers.unity3d.com/questions/247936/refresh-ondrawgizmos.html
Change Editor Temp folder location,"Aug 22, 2017 11:39:14 AM",4,2,https://answers.unity3d.com/questions/247589/change-editor-temp-folder-location.html
Getting the absolute path of current project,"Sep 23, 2017 5:10:43 AM",4,4,https://answers.unity3d.com/questions/245993/getting-the-absolute-path-of-current-project.html
Saving Texture2D as a PNG image to HDD in Standalone build.,"Jun 29, 2015 1:40:00 PM",4,2,https://answers.unity3d.com/questions/245600/saving-a-png-image-to-hdd-in-standalone-build.html
Shader Help: Adding transparency to a shader.,"Oct 10, 2017 6:35:44 AM",4,1,https://answers.unity3d.com/questions/244837/shader-help-adding-transparency-to-a-shader.html
How do I get my game on a Android device? (Galaxy S2),"Jun 9, 2016 1:12:13 PM",4,2,https://answers.unity3d.com/questions/243613/how-do-i-get-my-game-on-a-android-device-galaxy-s2.html
Unity Multithreading Problem,"Jan 6, 2016 3:30:30 AM",4,1,https://answers.unity3d.com/questions/243321/unity-multithreading-problem.html
GameObject.Find closest ??,"Mar 3, 2016 11:36:37 AM",4,3,https://answers.unity3d.com/questions/240541/gameobjectfind-closest-.html
How to play multiple audioclips from the same object?,"Sep 2, 2016 8:48:15 PM",4,3,https://answers.unity3d.com/questions/240468/how-to-play-multiple-audioclips-from-the-same-obje.html
Caching directory location on Android Devices?,"May 11, 2016 9:20:45 PM",4,0,https://answers.unity3d.com/questions/239734/caching-directory-location-on-android-devices.html
Can you unfreeze a rigidbody.constraint position as you can freeze them?,"Sep 11, 2015 4:46:13 AM",4,2,https://answers.unity3d.com/questions/238887/can-you-unfreeze-a-rigidbodyconstraint-position-as.html
Renaming game object clones,"Oct 6, 2016 4:21:42 AM",4,1,https://answers.unity3d.com/questions/238662/renaming-game-object-clones.html
Is there any way to detect if this is a development build from script?,"Jan 5, 2017 8:14:52 AM",4,2,https://answers.unity3d.com/questions/236387/is-there-any-way-to-detect-if-this-is-a-developmen.html
Rotate using physics,"Jan 23, 2017 2:13:35 PM",4,5,https://answers.unity3d.com/questions/236144/rotate-using-physics.html
Stopping overlapping textures from flickering?,"Aug 13, 2017 3:44:01 PM",4,5,https://answers.unity3d.com/questions/235802/stopping-overlapping-textures-from-flickering.html
Edit animation clip direct in code,"Apr 6, 2012 6:52:40 AM",4,1,https://answers.unity3d.com/questions/235706/edit-animation-clip-direct-in-code.html
on iphone is persistentDataPath the equivalent of Documents?,"Nov 23, 2012 4:05:56 PM",4,2,https://answers.unity3d.com/questions/235365/on-iphone-is-persistentdatapath-the-equivalent-of.html
[iOS] Social.Authenticate bug on user cancel ?,"Sep 8, 2015 8:55:06 PM",4,2,https://answers.unity3d.com/questions/234489/ios-socialauthenticate-bug-on-user-cancel-.html
"RPG armors and clothes, best way to animate each parts.","Dec 17, 2013 8:33:04 PM",4,3,https://answers.unity3d.com/questions/234395/rpg-armors-and-clothes-best-way-to-animate-each-pa.html
Support for Func and Action delegate on Iphone micro mscorlib?,"Apr 3, 2012 12:03:00 PM",4,1,https://answers.unity3d.com/questions/234135/support-for-func-and-action-delegate-on-iphone-mic.html
fixed update and time.deltatime,"Sep 1, 2014 10:54:28 PM",4,1,https://answers.unity3d.com/questions/233918/fixed-update-and-timedeltatime.html
random issue,"Oct 2, 2017 7:51:15 AM",4,2,https://answers.unity3d.com/questions/233436/random-issue.html
Objects being duplicated with DontDestroyOnLoad,"Aug 30, 2017 5:41:57 PM",4,6,https://answers.unity3d.com/questions/233284/objects-being-duplicated-with-dontdestroyonload.html
How to detach an object from prefab,"Jan 7, 2017 2:35:41 PM",4,2,https://answers.unity3d.com/questions/232670/how-to-detach-an-object-from-prefab.html
is there a way to catch global application exceptions?,"Mar 25, 2016 3:43:44 PM",4,3,https://answers.unity3d.com/questions/232589/is-there-a-way-to-catch-global-application-expceti.html
Class constructor,"Mar 28, 2012 9:47:50 AM",4,1,https://answers.unity3d.com/questions/232531/class-constructor.html
Is there any way to view 2d arrays in the inspector?,"Jul 23, 2017 9:51:12 PM",4,5,https://answers.unity3d.com/questions/231715/is-there-any-way-to-view-2d-arrays-in-the-inspecto.html
Quick question about updating an asset on the Asset Store?,"Feb 21, 2014 4:04:43 PM",4,1,https://answers.unity3d.com/questions/230254/quick-question-about-updating-an-asset-on-the-asse.html
texCoords rect for GUI.DrawTextureWithTexCoords,"Feb 13, 2017 8:14:14 AM",4,3,https://answers.unity3d.com/questions/230128/texcoords-rect-for-guidrawtexturewithtexcoords.html
Animation editor - trimming tail,"Feb 2, 2017 12:21:05 AM",4,3,https://answers.unity3d.com/questions/229783/animation-editor-trimming-tail.html
questions regarding benefits/costs of LODs,"Sep 11, 2012 11:40:31 PM",4,2,https://answers.unity3d.com/questions/227767/questions-regarding-benefitscosts-of-lods.html
Can I remove sub-assets?,"Mar 12, 2012 3:43:06 AM",4,1,https://answers.unity3d.com/questions/226162/can-i-remove-sub-assets.html
Big arrays are never garbage collected. Why?,"Jul 2, 2016 3:06:21 PM",4,1,https://answers.unity3d.com/questions/225460/big-arrays-are-never-garbage-collected-why.html
Monodevelop font bug...,"Mar 9, 2015 6:24:39 AM",4,9,https://answers.unity3d.com/questions/225164/monodevelop-font-bug.html
Determining if a variable is even or odd?,"Jul 5, 2014 12:55:29 PM",4,2,https://answers.unity3d.com/questions/224860/determining-if-a-variable-is-even-or-odd.html
Modifying Greyscale Shader for selective Colouring.,"Jun 27, 2012 4:05:35 PM",4,2,https://answers.unity3d.com/questions/223525/modifying-greyscale-shader-for-selective-colouring.html
Unity Editor Scripts: GameObject Added / Removed Event?,"Mar 27, 2012 6:35:26 PM",4,1,https://answers.unity3d.com/questions/223166/unity-editor-scripts-gameobject-added-removed-even.html
Why Script in Boo?,"Nov 4, 2016 9:05:56 PM",4,3,https://answers.unity3d.com/questions/220984/why-script-in-boo.html
how to change the size of a box collider in c#,"Nov 25, 2014 7:27:05 PM",4,1,https://answers.unity3d.com/questions/220744/how-to-change-the-size-of-a-box-collider-in-c.html
Why do edits no longer appear on this site?,"Jun 28, 2015 9:03:43 PM",4,2,https://answers.unity3d.com/questions/220301/why-do-edits-no-longer-appear-on-this-site.html
No Sound at all,"Oct 25, 2017 7:24:55 PM",4,8,https://answers.unity3d.com/questions/219467/no-sound-at-all.html
Water Pro reflection bug in augmented reality iOS app using Vuforia (QCAR) SDK,"Jul 14, 2014 4:28:00 PM",4,1,https://answers.unity3d.com/questions/219415/water-pro-reflection-bug-in-augmented-reality-ios.html
shuriken particle system not rendering particles when off screen,"Oct 18, 2017 6:56:53 PM",4,7,https://answers.unity3d.com/questions/218369/shuriken-particle-system-not-rendering-particles-w.html
#if UNITY_IPHONE code runs when played in Editor,"Feb 13, 2012 9:20:35 PM",4,3,https://answers.unity3d.com/questions/216917/if-unity-iphone-code-runs-when-played-in-editor.html
How to force warnings as errors?,"Mar 1, 2017 2:00:41 PM",4,3,https://answers.unity3d.com/questions/216838/how-to-force-warnings-as-errors.html
Horizontal Line,"Oct 18, 2017 9:22:01 AM",4,9,https://answers.unity3d.com/questions/216584/horizontal-line.html
Raycast Without Colliders,"Aug 29, 2015 7:33:31 PM",4,6,https://answers.unity3d.com/questions/215678/raycast-without-colliders.html
How to get faster script compilation?,"Jul 25, 2016 6:27:38 PM",4,4,https://answers.unity3d.com/questions/215517/how-to-get-faster-script-compilation.html
Changes to prefab parameters not being saved,"Jan 5, 2017 3:00:31 AM",4,5,https://answers.unity3d.com/questions/214618/changes-to-prefab-parameters-not-being-saved.html
Unity Free with iOS Basic - is In-App purchase possible?,"Feb 16, 2012 11:00:52 AM",4,1,https://answers.unity3d.com/questions/212768/unity-free-with-ios-basic-is-in-app-purchase-possi.html
destroy object after a delay?,"Apr 19, 2017 9:30:24 PM",4,6,https://answers.unity3d.com/questions/212464/destroy-object-after-a-delay.html
Crash on a stripped iOS binary when using System.Security.Cryptography,"Jul 1, 2013 12:30:29 PM",4,3,https://answers.unity3d.com/questions/211719/crash-on-a-stripped-ios-binary-when-using-systemse.html
How to manage inventory 'objects' in C# for behind the scenes inventory stuff,"Mar 9, 2014 11:42:29 PM",4,4,https://answers.unity3d.com/questions/211662/how-to-manage-inventory-objects-in-c-for-behind-th.html
Best way to make ramps,"Feb 26, 2015 7:42:48 PM",4,4,https://answers.unity3d.com/questions/211089/best-way-to-make-ramps.html
RenderTexture.SetActive() huge profiler spikes,"Feb 28, 2014 3:18:32 PM",4,13,https://answers.unity3d.com/questions/210896/rendertexturesetactive-huge-profiler-spikes.html
Is possible to rotate textures of a terrain?,"May 25, 2017 4:22:55 PM",4,3,https://answers.unity3d.com/questions/210857/is-possible-to-rotate-textures-of-a-terrain.html
How does the @ animation convention work?,"Jan 28, 2012 12:34:06 AM",4,1,https://answers.unity3d.com/questions/209870/how-does-the-animation-convention-work.html
"Low quality billboards in terrain, any way around it?","Jan 25, 2012 4:00:55 AM",4,0,https://answers.unity3d.com/questions/209729/low-quality-billboards-in-terrain-any-way-around-i.html
How to change material color of an Object,"May 3, 2017 1:33:29 PM",4,5,https://answers.unity3d.com/questions/209573/how-to-change-material-color-of-an-object.html
Disable Cache for WWW,"Feb 9, 2017 7:53:57 AM",4,7,https://answers.unity3d.com/questions/209078/disable-cache-for-www.html
How do I duplicate a material?,"Jul 4, 2013 12:29:46 AM",4,2,https://answers.unity3d.com/questions/208409/how-do-i-duplicate-a-material.html
Using System.Reflection with iOS,"Jan 31, 2017 3:53:04 PM",4,2,https://answers.unity3d.com/questions/207670/using-reflection-with-ios.html
How do you get the world position of a vertex in a shader?,"Aug 13, 2014 9:27:26 PM",4,1,https://answers.unity3d.com/questions/206478/how-do-you-get-the-world-position-of-a-vertex-in-a.html
Adding Scene to build,"May 8, 2016 12:41:32 AM",4,2,https://answers.unity3d.com/questions/205742/adding-scene-to-build.html
dust in a light effect,"Jan 13, 2012 8:14:22 AM",4,0,https://answers.unity3d.com/questions/205157/dust-in-a-light-effect.html
Saving Screenshots to Android Gallery,"Oct 9, 2017 10:58:20 AM",4,8,https://answers.unity3d.com/questions/204372/saving-screenshots-to-android-gallery.html
How to access persistent data path in Android phone?,"Dec 15, 2016 4:33:03 AM",4,2,https://answers.unity3d.com/questions/203852/how-to-access-persistent-data-path-in-android-phon.html
Is there any way to find out current LOD level of LODGroup?,"Aug 3, 2016 1:40:54 PM",4,2,https://answers.unity3d.com/questions/203623/is-there-any-way-to-find-out-current-lod-level-of.html
logcat only to show unity related things?,"Aug 14, 2016 5:30:08 PM",4,3,https://answers.unity3d.com/questions/203580/logcat-only-to-show-unity-related-things.html
Trying to make a 2nd camera viewport follow a GUI.Window,"May 27, 2013 8:55:09 AM",4,1,https://answers.unity3d.com/questions/203149/trying-to-make-a-2nd-camera-viewport-follow-a-guiw.html
Editor check if unity pro license installed,"Jan 25, 2015 6:15:26 AM",4,4,https://answers.unity3d.com/questions/199334/editor-check-if-unity-pro-license-installed.html
Resources.Load folders path?,"Dec 28, 2011 5:27:26 AM",4,1,https://answers.unity3d.com/questions/199313/resourcesload-folders-path.html
How to mark an object destroy on load again when DonDestroyOnLoad was called ?,"Feb 10, 2017 9:17:48 AM",4,3,https://answers.unity3d.com/questions/199170/how-to-mark-an-object-destroy-on-load-again-when-d.html
Everything on Hierarchy is gone execpt main camera,"May 6, 2016 2:37:09 AM",4,1,https://answers.unity3d.com/questions/198626/everything-on-hierarchy-is-gone-execpt-main-camera.html
Where is the downloaded asset directory ?,"Nov 7, 2016 7:42:52 AM",4,5,https://answers.unity3d.com/questions/198512/downloaded-asset-directory-.html
CombineMeshes with Different Materials,"Feb 5, 2016 2:51:19 AM",4,7,https://answers.unity3d.com/questions/196649/combinemeshes-with-different-materials.html
Stopping a rigidbody at target,"Mar 1, 2017 6:07:16 AM",4,1,https://answers.unity3d.com/questions/195698/stopping-a-rigidbody-at-target.html
Instantiated prefab loses components,"Dec 13, 2011 7:26:41 AM",4,1,https://answers.unity3d.com/questions/194020/instantiated-prefab-loses-components.html
1 pixel high texture imported as 2 pixels high,"Feb 13, 2014 5:46:31 AM",4,2,https://answers.unity3d.com/questions/193255/1-pixel-high-texture-imported-as-2-pixels-high.html
"Polar (spherical) coordinates to xyz, and vice versa.","Jan 9, 2017 8:32:42 PM",4,1,https://answers.unity3d.com/questions/189724/polar-spherical-coordinates-to-xyz-and-vice-versa.html
How to execute method in main thread from another threads?,"Feb 24, 2017 8:42:36 PM",4,1,https://answers.unity3d.com/questions/188960/how-to-execute-method-in-main-thread-from-another.html
SHADER: Get *object* position or distinct value per *object*,"Oct 23, 2017 4:21:06 AM",4,1,https://answers.unity3d.com/questions/187628/shader-get-object-position-or-distinct-value-per-o.html
"Is my ""unity default resources"" file corrupt?","Sep 28, 2014 11:26:17 AM",4,1,https://answers.unity3d.com/questions/186853/is-my-unity-default-resources-file-corrupt.html
multiply quaternion by vector,"Nov 30, 2015 3:12:33 PM",4,2,https://answers.unity3d.com/questions/186252/multiply-quaternion-by-vector.html
make objects push away from each other,"Nov 25, 2011 10:13:34 AM",4,2,https://answers.unity3d.com/questions/185338/make-objects-push-away-from-each-other.html
C# Movement Script (Basic),"May 18, 2017 11:01:26 AM",4,3,https://answers.unity3d.com/questions/185226/c-movement-script-basic.html
Different font style in same GUI paragraph,"Nov 12, 2011 10:26:04 AM",4,2,https://answers.unity3d.com/questions/184314/different-font-style-in-same-gui-paragraph.html
Jump to a specific frame in an animation,"Nov 30, 2015 9:33:23 AM",4,5,https://answers.unity3d.com/questions/181903/jump-to-a-specific-frame-in-an-animation.html
Shaders: Using Property for Offset,"Dec 10, 2014 10:27:35 PM",4,3,https://answers.unity3d.com/questions/181663/shaders-using-property-for-offset.html
addforce seems inconsistant,"Oct 5, 2016 8:56:04 AM",4,3,https://answers.unity3d.com/questions/180226/addforce-seems-inconsistant.html
Custom Mesh UV Problem,"Dec 4, 2011 2:19:53 PM",4,1,https://answers.unity3d.com/questions/180163/custom-mesh-uv-problem.html
How to make my enemy bleed,"Aug 14, 2014 7:33:23 PM",4,1,https://answers.unity3d.com/questions/179095/how-to-make-a-enemy-bleed.html
[Qato] What's up with the moderation queue now?,"Oct 31, 2011 1:36:05 PM",4,2,https://answers.unity3d.com/questions/179009/whats-up-with-the-moderation-queue-now.html
Shader Intellisense / Code completion,"Oct 12, 2015 2:21:45 PM",4,3,https://answers.unity3d.com/questions/178371/shader-intellisense-code-completion.html
What unit is Rigidbody Mass based on?,"Dec 4, 2016 8:29:06 PM",4,3,https://answers.unity3d.com/questions/177563/what-unit-is-rigidbody-mass-based-on.html
flare not showing in game window,"Jan 8, 2017 12:52:17 PM",4,1,https://answers.unity3d.com/questions/177269/flare-not-showing-in-game-window.html
THIN objects can fall through the ground? (AMAZING SOLUTION),"Oct 17, 2012 2:30:58 PM",4,2,https://answers.unity3d.com/questions/176953/thin-objects-can-fall-through-the-ground.html
Perform action on save/load in editor,"Apr 7, 2017 3:52:02 AM",4,2,https://answers.unity3d.com/questions/175931/perform-action-on-saveload-in-editor.html
renderer.materials not working.,"May 13, 2017 2:11:03 PM",4,1,https://answers.unity3d.com/questions/175370/renderermaterials-not-working.html
